Part Image,Part Name,Information
https://m.media-amazon.com/images/I/61vXYKMkDZL._AC_SY355_.jpg,DJI RC-N3 Remote Controller,Max Supported Mobile Device Size: 180×86×10 mm (L×W×H)
https://m.media-amazon.com/images/I/61EM2pLu3hL._AC_SY355_.jpg,DJI Neo Intelligent Flight Battery,"Measured after DJI Neo is activated, with a fully charged battery and default settings, and using Circle, Rocket, and Dronie modes, and is for reference only."
https://m.media-amazon.com/images/I/61U1hBHEfJL._AC_SY355_.jpg,DJI Neo Propeller Guard,In the Box: DJI Neo Propeller Guard (Pair) × 1
https://m.media-amazon.com/images/I/61U1hBHEfJL._AC_SY355_.jpg,DJI Neo Propeller Guard,In the Box: DJI Neo Propeller Guard (Pair) × 1
https://m.media-amazon.com/images/I/514K0mwj+KL._AC_SY355_.jpg,DJI Neo Two-Way Charging Hub,In the Box: DJI Neo Two-Way Charging Hub × 1
https://m.media-amazon.com/images/I/61x0QYbgd9L._AC_SY355_.jpg,DJI Mini 4 Pro Wide-Angle Lens,Compatibility：DJI Mini 4 ProPart Image
https://m.media-amazon.com/images/I/61+z4giRjxL._AC_SY355_.jpg,DJI Mini 4 Pro 360° Propeller Guard,"DJI Mini 4 Pro does not support obstacle avoidance after installing the propeller guard and cannot actively detour or brake when it senses an obstacle. When using intelligent features, the aircraft will not have obstacle avoidance capability."
https://m.media-amazon.com/images/I/51dedKdMp8L._AC_SY355_.jpg,DJI Mini 4 Pro/Mini 3 Series Intelligent Flight Battery Plus, Compatibility: DJI Mini 4 Pro/ DJI Mini 3 Pro/ DJI Mini 3"
https://m.media-amazon.com/images/I/615dFeoxZgL._AC_SY355_.jpg,DJI Mini 4 Pro ND Filters Set (ND16/64/256),Compatibility: DJI Mini 4 Pro 
https://m.media-amazon.com/images/I/51yLUyndiJL._AC_SY355_.jpg,DJI Remote Controller Mini 3 Pro/ Mavic 3/Cine/Classic and Air 2S Drone",4hr Battery - Fly longer to see and capture more with the DJI RC's 4hr max battery life. 
https://m.media-amazon.com/images/I/51odE-2tW8L._AC_SY355_.jpg,DJI Mini 3 Propellers,"When changing propellers, use the propellers in the same package. Do not mix propellers from different packages." 
https://m.media-amazon.com/images/I/51aExheFExL._AC_SX425_.jpg,DJI Mini 3 Series Propeller Holder, Compatibility: DJI Mini 3 Pro/ DJI Mini 3"
https://m.media-amazon.com/images/I/51fdOWPi3bL._AC_SX425_.jpg,DJI RC Control Sticks,Item Package Weight - 0.02 Pounds 
https://m.media-amazon.com/images/I/61JgOxu1bCL._AC_SY355_.jpg,DJI Mini 3 Pro Fly More Kit,"Includes Two Intelligent Flight Batteries, a Two-Way Charging Hub & Data Cable & Shoulder Bag & Spare propellers + Screws & unisex & Black"
https://m.media-amazon.com/images/I/51dedKdMp8L._AC_SY355_.jpg,DJI Mini 4 Pro/Mini 3 Series Intelligent Flight Battery Plus, Compatibility: DJI Mini 4 Pro/ DJI Mini 3 Pro/ DJI Mini 3"
https://m.media-amazon.com/images/I/51+4tC2xTiL._AC_SY355_.jpg,DJI Mini 4 Pro/Mini 3 Pro Propellers, Compatibility: DJI Mini 4 Pro/ DJI Mini 3 Pro"
https://m.media-amazon.com/images/I/51TK0P3ukML._AC_SY355_.jpg,DJI Mini 3 Series ND Filter Set (ND16/64/256), Compatibility: DJI Mini 3 Pro/ DJI Mini 3"
https://m.media-amazon.com/images/I/61bYAwbQFAL._AC_SY355_.jpg,DJI Mini 2 Propellers (Pair), Compatibility: DJI Mini 2 SE/ DJI Mini 4K/ DJI Mini 2/ DJI Mini SE" 
https://m.media-amazon.com/images/I/51RgS8r92ML._AC_SY355_.jpg,DJI RC Motion 3, "FPV Smart Controller with Immersive Motion Control, Compact and Portable, One-Click Emergency Brake, AR Cursor, Intuitive Drone Controller, Multi-Model Compatibility"
https://m.media-amazon.com/images/I/6184JUNS83L._AC_SY355_.jpg,DJI Goggles 3,"Compatibility - Compatible with DJI Neo, DJI Avata 2, DJI Mini 4 Pro, DJI Air 3, DJI RC Motion 3, DJI FPV Remote Controller 3, DJI O3 Air Unit, DJI RC-N2 and DJI RC 2. Please note that Goggles 3 does not work with DJI RC Motion 2 and DJI FPV Remote Controller 2." 
https://m.media-amazon.com/images/I/51lzH5BvNzL._AC_SY355_.jpg,DJI RC-N1 Remote Controller Monitor Hood,"ACCESSORY FOR MAVIC AIR 2: The new drone Mavic Air 2, powerful and portable, offers smart shooting and excellent image quality. A full charge guarantees 34 minutes of flight time" 
https://m.media-amazon.com/images/I/51lIB5IAqRL._AC_SY355_.jpg,DJI Goggles 2, "Motion Combo-Immersive, Multifunctional Motion Control; Lightweight and Portable FPV Drone Goggles, Micro-OLED Screens, DJI O3+ Video Transmission & Low-Latency"